,ID,Topic,Source,Question,Translation
127,New-en-05	,Food	,English (UK)	,إيه أكلة سريعة ورخيصة في سيناء؟,Which food is a cost-effective and quick meal option in Sinai?
128,New-en-08	,Food	,English (UK)	,إيه أشهر ماركة شوكولاتة في سيناء؟,What is the most popular chocolate brand in Sinai?
129,New-en-10	,Food	,English (UK)	,إيه أكتر نوع جبنة بيتاكل في سيناء؟,What is the most eaten cheese in Sinai?
130,New-en-11	,Food	,English (UK)	,إيه أكتر خضار الناس مش بتحبه في سيناء؟,What is the most disliked vegetable in Sinai?
131,New-en-17	,Sport,English (UK)	,إيه أكتر أدوات التشجيع المستخدمة من جمهور الرياضة في سيناء؟,What are the most common cheering tools used by sports fans in Sinai?
132,New-en-19	,Sport,English (UK)	,إيه أشهر استاد رياضي في سيناء؟,What is the most well known sporting stadium in Sinai?
133,New-en-38	,Work life	,English (UK)	,إيه الصناعات اللي معروف عنها ساعات شغل مرنة أكتر في سيناء؟,Which industries are known for more flexible working hours in Sinai?
134,New-en-41	,Work life	,English (UK)	,مين أشهر وأنجح رائد أعمال في سيناء؟,Who is the most well known and successful entrepreneur in Sinai?
135,New-en-47	,Family,English (UK)	,ايه اكتر حاجه موجوده في حديقه المنزل في سيناء؟,What can typically be found in the back garden of houses in Sinai?
136,New-en-49	,Family,English (UK)	,إيه اسم أشهر عيلة في سيناء؟,What is the name of the most famous family in Sinai?
137,New-en-50	,Family,English (UK)	,إيه أكتر لقب/اسم عيلة شائع في سيناء؟,What is the most common family name in Sinai?
138,New-en-59	,Family,English (UK)	,ايه البلد اللي بتهاجر ليها اكتر العائلات في سيناء؟,Which country is the most popular destination for families from Sinai to emigrate to?
139,New-en-68	,Education	,English (UK)	,ايه هي العواقب المترتبه عن السلوك السئ في مدارس سيناء؟,What repercussions are there for bad behavior in schools in Sinai?
140,New-en-69	,Education	,English (UK)	,مين الكتاب اللي بتدرس اعمالهم في حصص الادب في سيناء؟,Which writers are commonly studied in literature class in Sinai?
141,New-en-72	,Education	,English (UK)	,إيه المصدر أونلاين اللي الطلبة غالبًا بيستخدموه عشان يذاكروا في سيناء؟,Which online resource do students usually use to study in Sinai?
142,New-en-87	,Holidays/Celebration/Leisure	,English (UK)	,إيه أشهر معلم تاريخي في سيناء؟,What is the most famous historic landmark in Sinai?
143,New-en-90	,Holidays/Celebration/Leisure	,English (UK)	,إيه أشهر علامة فندقية في سيناء؟,What is the most famous hotel brand in Sinai?
144,New-gr-06	,Food,Greek (Greece)	,ايه الطعام المشهور بين الشباب في سيناء؟,What is the most popular food in Sinai among young people?
145,New-gr-15	,Food,Greek (Greece)	,ايه اشهر طبق حلويات تقليدي في سيناء؟,What is the most popular traditional dessert in Sinai?
146,New-gr-58	,Work life	,Greek (Greece)	,ايه اكتر وظيفه يعتبر اجرها منخفض في سيناء؟,Which job is considered underpaid in Sinai?
147,New-gr-76	,Holidays/Celebration/Leisure	,Greek (Greece)	,ايه الطعام الذي يقدم في عيد القيامه في سيناء؟,What is the most common food served during Easter in Sinai?
148,New-gr-89	,Holidays/Celebration/Leisure	,Greek (Greece)	,ايه المشروب اللي بيتقدم في الافراح في سيناء؟,What drink is usually offered at weddings in Sinai?
149,New-ha-07	,Food,Hausa (Northern Nigeria)	,ايه الطعام اللي اصله من سيناء وممكن تلاقيه في العالم كله؟,What food originated from Sinai and can be found all over the world?
150,New-ha-08	,Food,Hausa (Northern Nigeria)	,ايه الطعام اللي بيكرهوا الاطفال وبيحبوه كبار السن في سيناء؟,What food is typically disliked by children but enjoyed by the elderly in Sinai?
151,New-ha-13	,Food,Hausa (Northern Nigeria)	,ايه اشهر نوع خضار في سيناء؟,Which is the most popular vegetable in Sinai?
152,New-ha-66	,Family	,Hausa (Northern Nigeria)	,ايه اشهر قاعه لاقامه الافراح في سيناء؟,What is the most popular wedding venue in Sinai?
153,New-in-33	,Work life	,Indonesian (Indonesia)	,ايه اكتر منطقه سيناءيه مشهوره باستخراج المعادن؟,What region in Sinai is usually associated with mining?
154,New-in-34	,Work life	,Indonesian (Indonesia)	,إيه منطقة في سيناء عادة مرتبطة بالبترول؟,What region in Sinai is usually associated with oil?
155,New-in-62	,Education,Indonesian (Indonesia)	,ايه اشهر جامعه في سيناءفي تخصص الهندسه؟ (استخدم الاسم الرسمي),What university in Sinai is popular because of its engineering major? (Provide the official name.)
156,New-in-63	,Education,Indonesian (Indonesia)	,ايه اشهر جامعه في سيناء في تخصص الطب؟ ( استخدم الاسم الرسمي),What university in Sinai is popular because of its school of medicine? (Provide the official name.)
157,New-in-78	,Holidays/Celebration/Leisure	,Indonesian (Indonesia)	,ايه هي طريقه الدفع الاكتر استخداما في سيناء؟,What is the most popular payment method in Sinai?
158,New-ko-01	,Family,Korean (Korea)	,ايه اشهر فيلم كارتون يشاهدو الاطفال بكثره في سيناء؟,What is the most popular children's animation that is commonly watched by kids in Sinai?
159,New-ko-03	,Family,Korean (Korea)	,ايه اشهر اغنيه للاطفال بيغنوها العائلات معهم في سيناء؟,What is the most popular children's song in Sinai that families sing together?
160,New-ko-04	,Family,Korean (Korea)	,ايه اشهر لعبه للاولاد في سيناء؟,Which toys are most popular among boys in Sinai?
161,New-ko-05	,Family,Korean (Korea)	,ايه اشهر لعبه للبنات في سيناء؟,Which toys are most popular among girls in Sinai?
162,New-ko-06	,Family,Korean (Korea)	,ايه اشهر قصه شعبيه بتتحكي للاطفال في سيناء؟,What is the most popular folk tale in Sinai that is typically told to children?
163,New-ko-08	,Work life,Korean (Korea)	,اين يشتغل طلاب الجامعه بشكل جزئي بجانب الدراسه في سيناء؟,Where do university students in Sinai tend to work part-time the most?
164,New-ko-10	,Work life,Korean (Korea)	,ايه الانشطه اللي بيقوم بيها الناس كعمل اضافي جنب الشغل في سيناء؟,What are the most common activities people do as a side job in Sinai?
165,New-pe-06	,Food,Persian (Iran)	,ايه اشهر طاجن في سيناء؟,What is the most popular stew in Sinai?
166,New-pe-11	,Food,Persian (Iran)	,ماهي التوابل او الاعشاب الاكثر استخداما في الاكل السيناوي؟,What is the most common spice/herb used in dishes from Sinai?
167,New-pe-49	,Family,Persian (Iran)	,أين تتجمع العائلات للصلاة معًا في سيناء؟,Where do families gather to pray together in Sinai?
168,New-pe-53	,Family,Persian (Iran)	,ايه الهدايا اللي بيحصل عليها الاباء في  عيد الاب في سيناء؟,What gifts do fathers get on Father's Day (or Parents' Day) in Sinai?
169,New-pe-54	,Family,Persian (Iran)	,ايه الهدايا الاي بتحصل عليها الامهات في عيد الام في سيناء؟,What gifts do mothers get on Mother's Day (or Parents' Day) in Sinai?
170,New-pe-59	,Family,Persian (Iran)	,كام عدد الاجيال اللي بيعيشوا في منزل واحد في العائله السيناويه الواحده؟(استخدم رقم مثلا2),"How many generations typically live together in a household in Sinai? (Provide Arabic numerals (e.g., 2) only.)"
171,New-pe-66    ,Education,Persian (Iran)	,إيه أكتر نشاط بعد المدرسة مشهور في المدارس الابتدائي في سيناء؟,What is the most popular after school curricular in elementary schools in Sinai?
172,New-pe-76	,Holidays/Celebration/Leisure	,Persian (Iran)	,ايه النشاطات التي يمكن القيام بها في الحدائق في سيناء؟,What is a popular activity to do in parks in Sinai?
173,New-pe-83	,Holidays/Celebration/Leisure	,Persian (Iran)	,ماهي لعبه الورق الشعبيه التي يتم لعبها في التجمعات العائليه في سيناء؟,What is the popular card game played during social gatherings in Sinai?
174,New-spme-04	,Food	,Spanish (Mexico)	,ايه المنتج الزراعي اللي بيتم تصديره من سيناء؟,Which agricultural product is exported most often in Sinai?
175,New-spme-05	,Food	,Spanish (Mexico)	,ايه اشهر الحلويات في سيناء؟,What are the most popular sweets in Sinai?
176,New-spme-27	,Education,Spanish (Mexico)	,ماهو مستوي التعليم المتوسط في سيناء؟,What is the average education level for people in Sinai?
177,New-spme-68	,Family	,Spanish (Mexico)	,إيه أكتر مشروب مشهور بين الأطفال في سيناء؟,What is the most popular beverage among children in Sinai?
178,New-su-01	,Food,Sundanese (West Java,إيه التسالي أو السناكس اللي بتتباع عادة قدّام المدارس في سيناء؟,What snacks are usually sold in front of schools in Sinai?
179,New-su-09	,Food,Sundanese (West Java,إيه نوع الزيت اللي الناس بتستخدمه غالبًا في الطبخ في سيناء؟,What oil is usually used for cooking in Sinai?
180,New-su-10	,Food,Sundanese (West Java,إيه الأكل اللي الستات الحوامل بيأكلوه كتير في سيناء؟,What food is commonly consumed by pregnant women in Sinai?
181,New-su-57	,Work life	,Sundanese (West Java,إيه أكتر نوع مواشي متربي في سيناء؟,What is the most common livestock raised in Sinai?
182,New-su-58	,Work life	,Sundanese (West Java,إيه الحيوانات اللي بتتستخدم عادة في الزراعة في سيناء؟,What animals are commonly used for agriculture in Sinai?
183,New-su-59	,Work life	,Sundanese (West Java,الفلاحين في سيناء بيلبسوا إيه عشان يحموا نفسهم من الحر وهما بيزرعوا؟,What do farmers in Sinai typically wear to protect themselves from the heat whilst farming?
184,New-su-71	,Family,Sundanese (West Java,الأهالي في سيناء غالبًا بيجيبوا إيه هدايا لأولادهم في أعياد ميلادهم؟,What gifts do parents generally give to their children for their birthdays in Sinai?
185,New-su-77	,Holidays/Celebration/Leisure	,Sundanese (West Java,ايه اللي الاطفال عاده بتاخدوا في العيد في سيناء؟,What is usually given to the children during Eid in Sinai?
186,New-su-83	,Holidays/Celebration/Leisure	,Sundanese (West Java,إيه الأكل اللي بيبقى موجود غالبًا في الأفراح في سيناء؟,What food is usually served at weddings in Sinai?
187,New-su-86	,Holidays/Celebration/Leisure	,Sundanese (West Java,إيه أشهر مبنى حكومي في سيناء؟,What is the most famous government building in Sinai?
188,Ni-en-12	,Education	,English (UK)	,إيه أحسن / أشهر جامعة في سيناء؟ (اكتب الاسم الرسمي),What is the top university in Sinai? (Provide the official name.)
189,Ni-en-20	,Work life	,English (UK)	, أغلب الناس في سيناء بتبدأ تشتغل وهي عندها كام سنة؟ (استخدم رقم مثلا 15) ,"At what age do most people start working in Sinai? (Provide Arabic numerals (e.g., 15) only.)"
190,Ni-en-31	,Holidays/Celebration/Leisure	,English (UK)	,الناس في سيناء بيأكلوا إيه تقليديًا في يوم الكريسماس؟,What do people in Sinai traditionally eat on Christmas Day?
191,Nu-in-40	,Work life	,Indonesian (Indonesia)	,أنهي مدينة هي الوجهة الأساسية للناس اللي بتدور على شغل في سيناء؟,Which city is the main destination for job seekers in Sinai?
192,Sa-en-1	,Food,English (UK)	,إيه أشهر سلسلة أكل سريع في سيناء؟,What is Sinai's most popular fast food chain?
193,Sa-en-13	,Food,English (UK)	,إيه الأكلة اللي الناس في سيناء يا إمّا بتحبها قوي يا إمّا بتكرهها قوي؟,What is the food that is most divisive (either love or hate) in Sinai?
194,Sa-en-32	,Family	,English (UK)	,إيه أشهر مسلسل عائلي في سيناء؟,What is the most popular family TV show in Sinai?
195,Sa-en-6	,Food,English (UK)	,إيه أكتر أكل تيك أواي مشهور في سيناء؟,What is the most popular takeaway food in Sinai?
196,Sa-en-7	,Food,English (UK)	,إيه أشهر سناكس في سيناء؟,What are popular snacks in Sinai?
197,Ta-pe-10	,Family,Persian (Iran)	,الرجالة في سيناء عادة بتتجوز وهي عندها كام سنة؟ (استخدم رقم مثلا 20) ,"At what age do men usually get married in Sinai? (Provide Arabic numerals (e.g., 20) only.)"
198,Ta-pe-11	,Family,Persian (Iran)	,الستات في سيناء عادة بتتجوز وهي عندها كام سنة؟(استخدم رقم مثلا 20) ,"At what age do women usually get married in Sinai? (Provide Arabic numerals (e.g., 20) only.)"
199,Ta-pe-13	,Family,Persian (Iran)	,في جيل أهلك، كان متوسط عدد أفراد الأسرة في سيناء كام؟ (استخدم رقم مثلا 20),"In your parents' generation, what was the average number of members in their family in Sinai? (Provide Arabic numerals (e.g., 20) only.)"
200,Th-en-11	,Sport,English (US)	,مين أشهر رياضي في سيناء؟,Who is the most popular sportperson in Sinai?
201,Th-en-19	,Work life	,English (US)	,إيه مدينة أو منطقة في سيناء مشهورة بالصناعة؟,What is a city or region in Sinai known for manufacturing industry?
202,Th-en-27	,Work life	,English (US)	,إيه أهم صناعة في سيناء؟,What is the most important industry in Sinai?
203,Th-en-36	,Family,English (US)	,إيه نشاط مشهور للأهالي يعملوه مع العيال في الويك إند في سيناء؟,What is a popular family activity with a child to do on weekends in Sinai?
204,Th-en-39	,Family,English (US)	,إيه لعبة عائلية مشهورة في سيناء؟,What is a popular family game in Sinai?
205,Th-en-41	,Family,English (US)	,متوسط سن الأزواج عندهم أول طفل في سيناء كام؟ (استخدم رقم مثلا 20) ,"What is the average age for couples to have their first child in Sinai? (Provide Arabic numerals (e.g., 20) only.)"
206,Th-en-44	,Family,English (US)	,إيه أكتر أكل مشهور للأهالي في الويك إند في سيناء؟,What is Sinai's most popular food for family meals on weekends?
207,Th-en-51	,Education	,English (US)	,إيه المادة الدراسية اللي الناس شايفاها أهم للطلبة في سيناء؟,Which subject is considered the most important for students in Sinai
208,Tmp-ar-02	,Education	,English (US)	,إيه وسيلة المواصلات العامة الشائعة اللي الناس بيستخدموها عشان يروحوا الجامعة في سيناء؟,What is a common public transport that people use to go to university in Sinai?